{
  "profile_id": "stage6_orbital_sunrise_24fps",
  "description": "Warm low-FPS stage-6 profile that exercises palette and motion evolution without changing the analyzer contract.",
  "canvas": {
    "width": 1280,
    "height": 720,
    "fps": 24
  },
  "palette": {
    "palette_id": "orbital_sunrise",
    "background_color": "#1b1a22",
    "panel_color": "#2b2632",
    "grid_color": "#6e5a69",
    "text_color": "#f5e9db",
    "accent_sequence": [
      "amber",
      "orange",
      "coral",
      "pink",
      "cyan"
    ],
    "colors": {
      "base03": "#1b1a22",
      "base02": "#2b2632",
      "base01": "#6e5a69",
      "base00": "#b28774",
      "base0": "#ddbea9",
      "base1": "#f5e9db",
      "amber": "#f4b860",
      "orange": "#f28f3b",
      "coral": "#ef6f6c",
      "pink": "#f7a1c4",
      "cyan": "#66d9ef"
    }
  },
  "motion": {
    "mode": "orbital_sunrise_pulse",
    "clock_source": "analysis_window_sequence.clock_seconds",
    "keyframe_source": "one_keyframe_per_analysis_window",
    "rotation_degrees_per_second": 18.0,
    "base_scale": 0.72,
    "envelope_scale_range": 0.64,
    "grid_alpha_base": 0.1,
    "grid_alpha_range": 0.2,
    "lane_center_y_ratio": 0.48,
    "lane_bias_y_range_ratio": 0.07,
    "lane_energy_base": 0.7,
    "lane_energy_scale": 0.48,
    "lane_wave_height_px": 14.0,
    "lane_orbit_px": 48.0,
    "lane_orbit_wave_px": 10.0,
    "base_radius_px": 76.0,
    "radius_range_px": 220.0,
    "base_opacity": 0.24,
    "opacity_range": 0.6,
    "base_stroke_width_px": 2.2,
    "stroke_width_range_px": 5.8
  },
  "title_area": {
    "x": 438,
    "y": 42,
    "width": 405,
    "height": 108,
    "max_lines": 2,
    "layout_strategy": "explicit_newlines_centered",
    "text_align": "center",
    "base_font_size_px": 30,
    "line_gap_px": 8
  },
  "soundscape_badges": {
    "x": 438,
    "y": 564,
    "width": 405,
    "height": 66,
    "badge_gap_px": 6,
    "font_size_px": 14
  },
  "footer_progress_area": {
    "x": 438,
    "y": 646,
    "width": 405,
    "height": 42,
    "format_template": "{played_unique_count} / {total_combinations}",
    "text_align": "center",
    "font_size_px": 19
  },
  "selector_label_sprites": {
    "x": 438,
    "y": 170,
    "width": 405,
    "height": 370,
    "random_seed_source": "selection.combination_id",
    "label_min_font_size_px": 17,
    "label_max_font_size_px": 23,
    "label_padding_px": 10,
    "idle_drift_px": 9,
    "idle_rotation_degrees": 5,
    "active_bounce_y_px": 15,
    "active_scale_multiplier": 1.08
  },
  "spectrum_trails": {
    "x": 438,
    "y": 154,
    "width": 405,
    "height": 410,
    "trail_count": 5,
    "envelope_floor": 0.1,
    "envelope_ceiling": 0.95,
    "stroke_min_width_px": 1.6,
    "stroke_max_width_px": 6.2,
    "alpha_base": 0.14,
    "alpha_range": 0.32
  },
  "short_safe_layout": {
    "x": 438,
    "y": 0,
    "width": 405,
    "height": 720,
    "target_aspect_ratio": "9:16"
  },
  "text_overrides": {
    "default_toml_path": "src/musikalisches/runtime/config/stage6_default_text_overrides.toml",
    "toml_section": "stage6.text_overrides",
    "title_key": "title",
    "newline_mode": "escaped_or_literal_newline",
    "horizontal_alignment": "center",
    "max_title_lines": 2
  },
  "preview": {
    "sampled_window_limit": 144,
    "title": "musikalisches stage6 orbital sunrise preview",
    "geometry_label": "warm orbit pulse geometry",
    "envelope_label": "sampled analyzer envelope in sunrise cadence"
  }
}
